{
 "case": "robertson.Rodas4.adaptive",
 "producer": "reference",
 "t": [0.0, 0.4, 4.0, 40.0],
 "u": [[1.0, 0.0, 0.0],
  [0.9851721138609947, 3.3863953789679524e-5, 0.014794022185214483],
  [0.9055186785843357, 2.2404756875073836e-5, 0.09445891665878782],
  [0.7158270687194603, 9.185534764689808e-6, 0.28416374574577324]],
 "stats": {"accepted": 518, "rejected": 3, "rhs_calls": 4170}
}
