{
 "case": "photostationary_cells.Rosenbrock23.adaptive",
 "producer": "reference",
 "t": [0.0, 1800.0, 3600.0],
 "u": [[10.0, 10.0, 10.0, 10.0, 10.0, 10.0, 10.0, 10.0, 10.0, 10.0, 10.0, 10.0, 10.0, 10.0, 10.0, 10.0, 5.0, 5.0, 5.0, 5.0, 5.0, 5.0, 5.0, 5.0, 5.0, 5.0, 5.0, 5.0, 5.0, 5.0, 5.0, 5.0, 40.0, 40.0, 40.0, 40.0, 40.0, 40.0, 40.0, 40.0, 40.0, 40.0, 40.0, 40.0, 40.0, 40.0, 40.0, 40.0],
  [11.40353909630601, 12.40066929737103, 13.479017083144191, 14.42647091351367, 14.941949180235767, 14.78361754477554, 13.991380091500424, 12.879580921298615, 11.77296679548379, 10.851516712565173, 10.178935561640234, 9.76545078809714, 9.605035021794937, 9.691375922568547, 10.022272630307375, 10.596608950989603, 3.5964609036940893, 2.5993307026289267, 1.520982916855623, 0.5735290864862493, 0.05805081976426269, 0.21638245522446498, 1.0086199084995011, 2.120419078701419, 3.22703320451622, 4.148483287434753, 4.821064438359646, 5.234549211902862, 5.394964978204949, 5.308624077431429, 4.977727369692671, 4.403391049010405, 38.59646090369383, 37.599330702628116, 36.520982916855914, 35.57352908648596, 35.05805081976372, 35.216382455224434, 36.008619908499675, 37.120419078700934, 38.227033204516154, 39.14848328743475, 39.82106443835962, 40.23454921190291, 40.3949649782054, 40.30862407743153, 39.977727369692886, 39.40339104901007],
  [11.772966795483896, 10.851516712565058, 10.178935561640197, 9.765450788097066, 9.605035021794956, 9.691375922568593, 10.022272630307262, 10.596608950989545, 11.403539096306002, 12.400669297371088, 13.479017083144228, 14.426470913513686, 14.941949180235548, 14.783617544775534, 13.99138009150051, 12.879580921298599, 3.2270332045162724, 4.148483287434792, 4.821064438359599, 5.2345492119028645, 5.394964978205077, 5.308624077431462, 4.9777273696926105, 4.403391049010403, 3.5964609036941027, 2.5993307026288757, 1.5209829168556384, 0.5735290864862479, 0.05805081976425653, 0.21638245522446634, 1.0086199084995109, 2.1204190787014108, 38.22703320451585, 39.148483287433876, 39.82106443835984, 40.2345492119026, 40.394964978204555, 40.30862407743155, 39.97772736969287, 39.403391049009855, 38.596460903693675, 37.59933070262897, 36.520982916855615, 35.57352908648603, 35.05805081976485, 35.21638245522432, 36.00861990849947, 37.120419078700984]],
 "stats": {"accepted": 2728, "rejected": 0, "rhs_calls": 21826}
}
