{
 "case": "advection_reaction.lie.order",
 "producer": "reference",
 "t": [0.0, 0.5],
 "u": [[1.024533837163709, 1.073365237227681, 1.121490089951632, 1.16844492669611, 1.213777546715141, 1.2570513720966108, 1.2978496522462166, 1.3357794774235092, 1.3704755626774796, 1.4016037657403224, 1.4288643050001362, 1.4519946465617217, 1.4707720325915103, 1.485015626597272, 1.4945882549823906, 1.4993977281025863, 1.4993977281025863, 1.4945882549823906, 1.485015626597272, 1.4707720325915103, 1.4519946465617217, 1.4288643050001362, 1.4016037657403224, 1.3704755626774796, 1.3357794774235092, 1.2978496522462168, 1.257051372096611, 1.213777546715141, 1.16844492669611, 1.121490089951632, 1.073365237227681, 1.024533837163709, 0.9754661628362912, 0.9266347627723193, 0.8785099100483681, 0.83155507330389, 0.7862224532848591, 0.7429486279033892, 0.7021503477537834, 0.6642205225764908, 0.6295244373225206, 0.5983962342596775, 0.571135694999864, 0.5480053534382785, 0.5292279674084897, 0.514984373402728, 0.5054117450176095, 0.5006022718974138, 0.5006022718974138, 0.5054117450176095, 0.514984373402728, 0.5292279674084895, 0.5480053534382783, 0.5711356949998638, 0.5983962342596774, 0.6295244373225204, 0.6642205225764907, 0.7021503477537834, 0.742948627903389, 0.7862224532848587, 0.83155507330389, 0.8785099100483679, 0.9266347627723188, 0.975466162836291, 0.0, 0.0, 0.0, 0.0, 0.0, 0.0, 0.0, 0.0, 0.0, 0.0, 0.0, 0.0, 0.0, 0.0, 0.0, 0.0, 0.0, 0.0, 0.0, 0.0, 0.0, 0.0, 0.0, 0.0, 0.0, 0.0, 0.0, 0.0, 0.0, 0.0, 0.0, 0.0, 0.0, 0.0, 0.0, 0.0, 0.0, 0.0, 0.0, 0.0, 0.0, 0.0, 0.0, 0.0, 0.0, 0.0, 0.0, 0.0, 0.0, 0.0, 0.0, 0.0, 0.0, 0.0, 0.0, 0.0, 0.0, 0.0, 0.0, 0.0, 0.0, 0.0, 0.0, 0.0],
  [0.20064211892607975, 0.2078847299560513, 0.21633547961372906, 0.22591298256025844, 0.2365250022066704, 0.24806933900264852, 0.26043481467407126, 0.27350234293056813, 0.2871460763315877, 0.3012346182660594, 0.3156322883735695, 0.33020042922041903, 0.34479874164649493, 0.3592866359228848, 0.3735245857078202, 0.3873754717616151, 0.40070590247990723, 0.4133874985277263, 0.42529812920266447, 0.43632308862030994, 0.44635620039461454, 0.4553008401745354, 0.46307086618935384, 0.46959144884101905, 0.47479979135408334, 0.47864573454297366, 0.4810922398723788, 0.4821157461585759, 0.4817063964765273, 0.47986813308744264, 0.4766186594726562, 0.47198926983942024, 0.466024547740588, 0.4587819367106145, 0.4503311870529386, 0.4407536841064078, 0.4301416644599964, 0.4185973276640186, 0.406231851992595, 0.3931643237360989, 0.379520590335079, 0.36543204840060706, 0.35103437829309764, 0.33646623744624726, 0.32186792502017236, 0.30738003074378123, 0.2931420809588471, 0.27929119490505117, 0.2659607641867601, 0.2532791681389395, 0.24136853746400327, 0.2303435780463562, 0.2203104662720525, 0.21136582649213143, 0.20359580047731274, 0.19707521782564782, 0.19186687531258384, 0.1880209321236925, 0.18557442679428873, 0.18455092050809052, 0.18496027019013947, 0.1867985335792242, 0.190048007194011, 0.19467739682724566, 0.41211896370228784, 0.42875899623018415, 0.4476902096779455, 0.4687302861112162, 0.4916765980922678, 0.516308160092993, 0.5423877567063434, 0.5696642271603741, 0.5978748841337785, 0.6267480435783875, 0.6560056411850762, 0.6853659102950617, 0.7145460954668593, 0.7432651755657532, 0.7712465701509444, 0.7982208030963914, 0.8239280977932143, 0.8481208789404452, 0.8705661568305173, 0.8910477711675122, 0.9093684728089751, 0.9253518233829846, 0.9388438944861249, 0.9497147500981565, 0.9578596979369207, 0.9632002977022501, 0.9656851164989341, 0.9652902241636222, 0.9620194237253722, 0.9559042147804065, 0.9470034901337784, 0.935402968629466, 0.9212143696310451, 0.9045743371031495, 0.8856431236553877, 0.8646030472221172, 0.8416567352410655, 0.8170251732403402, 0.7909455766269899, 0.7636691061729591, 0.7354584491995547, 0.7065852897549459, 0.6773276921482568, 0.6479674230382716, 0.6187872378664737, 0.59006815776758, 0.5620867631823886, 0.535112530236942, 0.5094052355401187, 0.4852124543928885, 0.4627671765028158, 0.4422855621658214, 0.42396486052435817, 0.40798150995034865, 0.3944894388472085, 0.3836185832351769, 0.3754736353964125, 0.3701330356310835, 0.36764821683439913, 0.36804310916971134, 0.37131390960796123, 0.3774291185529268, 0.3863298431995548, 0.39793036470386756]],
 "stats": {"accepted": 65, "rejected": 2, "rhs_calls": 1074}
}
